{
  "schema_version": "local-ai.model-catalog/v1",
  "catalog_version": "1.0.0",
  "reviewed_at": "2026-10-20",
  "entries": [
    {
      "id": "devstral-small-2-24b-q4km",
      "status": "deprecated",
      "model": {
        "ollama_name": "devstral-small-2:24b-instruct-2512-q4_K_M",
        "family": "Devstral Small 2",
        "parameter_scale_billion": 24,
        "quantization": "Q4_K_M",
        "architecture": "mistral3"
      },
      "source": {
        "publisher": "Mistral AI",
        "model_page": "https://ollama.com/library/devstral-small-2:24b-instruct-2512-q4_K_M",
        "registry_manifest": "https://registry.ollama.ai/v2/library/devstral-small-2/manifests/24b-instruct-2512-q4_K_M",
        "expected_model_digest": "sha256:c580819bed79c92d01a42227bd6d8fd66b9ec60d5329f5eb73f812f156af7807"
      },
      "download": {
        "minimum_bytes": 15100000000,
        "maximum_bytes": 15250000000
      },
      "context": {
        "advertised_native_tokens": 393216,
        "required_tokens": 65536,
        "verification_method": "both",
        "extended_context_requirements": [
          "The manager configures only 65,536 tokens; larger advertised limits require separate memory validation.",
          "Runtime /api/ps evidence remains authoritative for the allocated context."
        ]
      },
      "tools": {
        "advertised": true,
        "evidence_level": "official_claim",
        "structured_call_verified": false,
        "large_tool_set": {
          "status": "claimed",
          "tested_definition_count": null
        },
        "complex_schema": "claimed",
        "known_template_caveats": [
          "Runtime structured-call acceptance is required before setup succeeds.",
          "Tool-count limits in the client are independent of model capability."
        ],
        "evidence_references": [
          "https://ollama.com/library/devstral-small-2",
          "https://huggingface.co/mistralai/Devstral-Small-2-24B-Instruct-2512"
        ]
      },
      "ollama_compatibility": {
        "minimum_version": "0.12.0",
        "maximum_tested_version": "0.40.6"
      },
      "license": {
        "identifier": "Apache-2.0",
        "name": "Apache License 2.0",
        "commercial_use": "allowed",
        "summary": "Upstream distributes the model under Apache-2.0, which generally permits commercial use subject to its terms; this summary is not legal advice.",
        "source": "https://mistral.ai/news/devstral-2-vibe-cli/"
      },
      "eligibility": {
        "operating_systems": ["windows", "macos", "linux"],
        "architectures": ["amd64", "arm64"],
        "execution_modes": ["cpu_only", "apple_unified", "integrated_shared", "dedicated_gpu"],
        "disqualifiers": [
          "unsupported_architecture",
          "cloud_only",
          "native_context_below_minimum",
          "license_incompatible",
          "tool_capability_failed",
          "insufficient_disk",
          "insufficient_memory_headroom",
          "ollama_version_incompatible",
          "blocked_status"
        ]
      },
      "host_tiers": [
        {
          "execution_mode": "cpu_only",
          "minimum_system_memory_bytes": 51539607552,
          "minimum_accelerator_memory_bytes": null,
          "minimum_free_storage_bytes": 25769803776,
          "expected_offload": "cpu",
          "notes": ["CPU execution is eligible but may be too slow for comfortable agent loops."]
        },
        {
          "execution_mode": "apple_unified",
          "minimum_system_memory_bytes": 42949672960,
          "minimum_accelerator_memory_bytes": null,
          "minimum_free_storage_bytes": 25769803776,
          "expected_offload": "full_gpu",
          "notes": ["Unified memory is one pool and is never added to a separate VRAM amount."]
        },
        {
          "execution_mode": "integrated_shared",
          "minimum_system_memory_bytes": 51539607552,
          "minimum_accelerator_memory_bytes": null,
          "minimum_free_storage_bytes": 25769803776,
          "expected_offload": "unknown",
          "notes": ["Shared graphics memory is one system-memory pool; actual offload must be measured."]
        },
        {
          "execution_mode": "dedicated_gpu",
          "minimum_system_memory_bytes": 25769803776,
          "minimum_accelerator_memory_bytes": 17179869184,
          "minimum_free_storage_bytes": 25769803776,
          "expected_offload": "partial_gpu",
          "notes": ["Full offload generally requires more accelerator memory than this minimum; runtime evidence decides."]
        }
      ],
      "memory_estimate": {
        "formula_version": 1,
        "model_weights_bytes": {
          "minimum_bytes": 15100000000,
          "maximum_bytes": 15250000000
        },
        "kv_cache_bytes_per_token": {
          "minimum_bytes": 98304,
          "maximum_bytes": 163840
        },
        "runtime_overhead_bytes": {
          "minimum_bytes": 2147483648,
          "maximum_bytes": 4294967296
        },
        "minimum_os_editor_headroom_bytes": 8589934592
      },
      "recommendation": {
        "agent_reliability_tier": 5,
        "tool_schema_tier": 5,
        "cpu_fallback_tier": 2,
        "score_adjustments": [
          {
            "reason": "Upstream lifecycle marks Devstral Small 2 deprecated",
            "points": -30
          }
        ]
      },
      "known_caveats": [
        "Mistral's lifecycle documentation marks Devstral Small 2 deprecated as of February 10, 2026.",
        "The exact tag remains recorded for existing installations but is excluded from default recommendations."
      ],
      "evidence_date": "2026-10-20",
      "references": [
        "https://ollama.com/library/devstral-small-2",
        "https://ollama.com/library/devstral-small-2/tags",
        "https://huggingface.co/mistralai/Devstral-Small-2-24B-Instruct-2512",
        "https://mistral.ai/news/devstral-2-vibe-cli/",
        "https://github.com/ollama/ollama/releases/tag/v0.40.6"
      ]
    },
    {
      "id": "qwen3-coder-30b-a3b-q4km",
      "status": "recommended",
      "model": {
        "ollama_name": "qwen3-coder:30b-a3b-q4_K_M",
        "family": "Qwen3-Coder",
        "parameter_scale_billion": 30.5,
        "quantization": "Q4_K_M",
        "architecture": "qwen3moe"
      },
      "source": {
        "publisher": "Qwen",
        "model_page": "https://ollama.com/library/qwen3-coder:30b-a3b-q4_K_M",
        "registry_manifest": "https://registry.ollama.ai/v2/library/qwen3-coder/manifests/30b-a3b-q4_K_M",
        "expected_model_digest": "sha256:1194192cf2a187eb02722edcc3f77b11d21f537048ce04b67ccf8ba78863006a"
      },
      "download": {
        "minimum_bytes": 18450000000,
        "maximum_bytes": 18700000000
      },
      "context": {
        "advertised_native_tokens": 262144,
        "required_tokens": 65536,
        "verification_method": "both",
        "extended_context_requirements": [
          "The manager configures only 65,536 tokens and does not infer memory fit from the larger native limit.",
          "Runtime /api/ps evidence remains authoritative for the allocated context."
        ]
      },
      "tools": {
        "advertised": true,
        "evidence_level": "official_claim",
        "structured_call_verified": false,
        "large_tool_set": {
          "status": "claimed",
          "tested_definition_count": null
        },
        "complex_schema": "claimed",
        "known_template_caveats": [
          "The reviewed release has official tool-calling claims but still requires local acceptance.",
          "Client-side tool limits can reject requests before inference."
        ],
        "evidence_references": [
          "https://ollama.com/library/qwen3-coder",
          "https://ollama.com/blog/coding-models",
          "https://huggingface.co/Qwen/Qwen3-Coder-30B-A3B-Instruct"
        ]
      },
      "ollama_compatibility": {
        "minimum_version": "0.12.0",
        "maximum_tested_version": "0.40.6"
      },
      "license": {
        "identifier": "Apache-2.0",
        "name": "Apache License 2.0",
        "commercial_use": "allowed",
        "summary": "Upstream distributes the model under Apache-2.0, which generally permits commercial use subject to its terms; this summary is not legal advice.",
        "source": "https://huggingface.co/Qwen/Qwen3-Coder-30B-A3B-Instruct/blob/main/LICENSE"
      },
      "eligibility": {
        "operating_systems": ["windows", "macos", "linux"],
        "architectures": ["amd64", "arm64"],
        "execution_modes": ["cpu_only", "apple_unified", "integrated_shared", "dedicated_gpu"],
        "disqualifiers": [
          "unsupported_architecture",
          "cloud_only",
          "native_context_below_minimum",
          "license_incompatible",
          "tool_capability_failed",
          "insufficient_disk",
          "insufficient_memory_headroom",
          "ollama_version_incompatible",
          "blocked_status"
        ]
      },
      "host_tiers": [
        {
          "execution_mode": "cpu_only",
          "minimum_system_memory_bytes": 68719476736,
          "minimum_accelerator_memory_bytes": null,
          "minimum_free_storage_bytes": 26843545600,
          "expected_offload": "cpu",
          "notes": ["CPU fallback is possible only on high-memory hosts and may be slow."]
        },
        {
          "execution_mode": "apple_unified",
          "minimum_system_memory_bytes": 51539607552,
          "minimum_accelerator_memory_bytes": null,
          "minimum_free_storage_bytes": 26843545600,
          "expected_offload": "full_gpu",
          "notes": ["Unified memory is evaluated as one pool."]
        },
        {
          "execution_mode": "integrated_shared",
          "minimum_system_memory_bytes": 68719476736,
          "minimum_accelerator_memory_bytes": null,
          "minimum_free_storage_bytes": 26843545600,
          "expected_offload": "unknown",